{"chain_end_boundary_commitment":"120422132b9afc145a027a03c4de72f88ea7ccadb83ee7fe105a25622edf9d41","chain_start_boundary_commitment":"123ceb06917ccf1a6050e14d1628a38f663635579b082016d4223643c8366a68","cryptographic_compression_claimed":false,"input_lookup_rows_commitments_commitment":"d3ff76c043bffb240b66da135ae6ec5693cf8eae06026144339eb185fa5b5c49","output_lookup_rows_commitments_commitment":"3c561a63e30b35c7a2bdaf886ebc0b5d88728eb293dd565f823509049848a855","phase30_source_chain_commitment":"23f8e50a1643e9344efb48939348280e67c1893143271a2af18e1f89cd03f4cb","phase30_step_envelopes_commitment":"7b2aa813a79a6b9999f00bffe8ebac5a43c149a6b9261f883ad03553fec071fc","phase32_recursive_statement_contract_commitment":"8dc229a60f7cb8df9997ff09c747091ba92ca03a6326581e764574ba4c7109d0","phase33_recursive_public_inputs_commitment":"ec6f1a210c06e32074d3e38326ada0f0df812e17c3c72f972d631fc759ab68de","phase34_shared_lookup_public_inputs_commitment":"1ecea1d475cd775b5e922e17e05e06eeb65e09a89fe323d3664dec5f46e4f230","phase35_manifest_version":"stwo-phase35-recursive-compression-target-manifest-v1","phase35_recursive_target_manifest_commitment":"947b1c28811398a5afb3b88ecaeab804f37c99fce54459828812d9ee2bd8b416","phase35_semantic_scope":"stwo_execution_parameterized_recursive_compression_target_manifest","proof_backend":"stwo","proof_backend_version":"stwo-phase12-decoding-family-v9","receipt_version":"stwo-phase36-recursive-verifier-harness-receipt-v1","recursive_verification_claimed":false,"recursive_verifier_harness_receipt_commitment":"5e4326fe8b0d6b1e49b9b0ea106c647693a88d4c069cd898f9742e0d61bb70c3","required_recursion_posture":"pre-recursive-proof-carrying-aggregation","semantic_scope":"stwo_execution_parameterized_recursive_verifier_harness_receipt","shared_lookup_artifact_commitments_commitment":"01c8146c7a2a9e4ea75414724352508fba5e1940e98597747cd3c7c74ac9ab7b","source_binding_verified":true,"statement_version":"statement-v1","static_lookup_registry_commitments_commitment":"9b6e52090604a75c06b7bececc05f4a2a13987195ac66ed4ccc48d170af5b5a6","step_relation":"decoding_step_v2","target_manifest_verified":true,"total_steps":3,"verifier_harness":"source-bound-target-verifier-v1"}
